{
  "$schema": "http://json-schema.org/draft-07/schema#",
  "title": "Eval Set Provenance v1",
  "description": "Provenance metadata for frozen evaluation set v2 (M30). Documents origin, selection logic, and reproducibility guarantees for synthetic frozen eval data.",
  "type": "object",
  "required": [
    "version",
    "createdAt",
    "generatorVersion",
    "selectionSeed",
    "positionSources",
    "skillBucketStrategy",
    "timeControlStrategy",
    "timePressureStrategy",
    "auditNotes",
    "determinismHash"
  ],
  "properties": {
    "version": {
      "type": "string",
      "const": "1.0",
      "description": "Provenance schema version"
    },
    "createdAt": {
      "type": "string",
      "format": "date-time",
      "description": "ISO 8601 timestamp of provenance artifact creation"
    },
    "generatorVersion": {
      "type": "string",
      "minLength": 1,
      "description": "Version of the frozen eval generator used (e.g., 'v2.0.0')"
    },
    "selectionSeed": {
      "type": "integer",
      "description": "Random seed used for deterministic selection (fixed for reproducibility)"
    },
    "positionSources": {
      "type": "array",
      "items": {
        "type": "string",
        "minLength": 1
      },
      "minItems": 1,
      "description": "List of sources for chess positions (e.g., 'algorithmic_fen_seeds_v1')"
    },
    "skillBucketStrategy": {
      "type": "string",
      "minLength": 1,
      "description": "Strategy used for skill bucket assignment (e.g., 'uniform_synthetic')"
    },
    "timeControlStrategy": {
      "type": "string",
      "minLength": 1,
      "description": "Strategy used for time control assignment (e.g., 'random_uniform')"
    },
    "timePressureStrategy": {
      "type": "string",
      "minLength": 1,
      "description": "Strategy used for time pressure assignment (e.g., 'random_uniform')"
    },
    "auditNotes": {
      "type": "string",
      "minLength": 1,
      "description": "Explicit audit statement about the synthetic nature of this eval set. Required for governance clarity."
    },
    "determinismHash": {
      "type": "string",
      "pattern": "^sha256:[a-f0-9]{64}$",
      "description": "SHA-256 hash of canonical provenance content"
    }
  }
}

