{"auditNotes":"Frozen eval v2 is synthetic but chess-valid, and is intended for *relative* evaluation and calibration stability, not absolute strength claims. Generated by M30 FROZEN-EVAL-SCALESET-001.","createdAt":"2026-02-02T00:00:00Z","determinismHash":"sha256:a2526b2d367bb4215bec8d31d61f8b4845aa5c5b5ad7f4840e21699ce339afce","generatorVersion":"v2.0.0","positionSources":["algorithmic_fen_seeds_v1","deterministic_expansion"],"selectionSeed":42,"skillBucketStrategy":"round_robin_uniform","timeControlStrategy":"seeded_random_uniform","timePressureStrategy":"seeded_random_uniform","version":"1.0"}